{"active_align_revision_id":"align:a1","active_source_metadata_revision_id":"metadata:m1","align_revisions":[{"created_at":"2026-07-11T00:00:00Z","extensions":{},"id":"align:a1","matrix4x4":[[1.0,0.0,0.0,5.0],[0.0,1.0,0.0,-2.0],[0.0,0.0,1.0,3.0],[0.0,0.0,0.0,1.0]],"operator":"tester","parent_id":null,"qc":{"rigid":true},"recipe":{"kind":"manual_matrix"},"source_metadata_revision_id":"metadata:m1"}],"document_id":"artifact:test-1","extensions":{"org.archmeshrubbing:test":{"korean":"유물"}},"geometry_revisions":[{"created_at":"2026-07-11T00:00:00Z","extensions":{},"geometry_hash_scope":"positions-f64le+triangles-i32le/v1","geometry_sha256":"bbbbbbbbbbbbbbbbbbbbbbbbbbbbbbbbbbbbbbbbbbbbbbbbbbbbbbbbbbbbbbbb","id":"geometry:g1","import_recipe":{"format":"ply","process":false},"operator":"tester","qc":{"finite_vertices":true},"source_asset_ids":["sha256:aaaaaaaaaaaaaaaaaaaaaaaaaaaaaaaaaaaaaaaaaaaaaaaaaaaaaaaaaaaaaaaa"],"topology_map_ref":"payload:topology-g1"}],"records":[{"align_revision_id":"align:a1","created_at":"2026-07-11T00:00:00Z","depends_on_record_ids":[],"extensions":{},"geometry_ref":"payload:cutline-r1.svg","geometry_revision_id":"geometry:g1","id":"record:r1","lifecycle_status":"ready","operator":"tester","qc":{"components":1},"recipe":{"kind":"cutline","precision_mm":0.1},"recipe_hash":"2d134d61aff584ebbd89cf4eac183b18def64091c82122b46176ae3562b7a656","selection_hash":"cccccccccccccccccccccccccccccccccccccccccccccccccccccccccccccccc","type":"cutline"}],"schema_version":"1.0.0","software_version":"0.1.0","source_assets":[{"asset_ref":"external:artifact.ply","extensions":{},"id":"sha256:aaaaaaaaaaaaaaaaaaaaaaaaaaaaaaaaaaaaaaaaaaaaaaaaaaaaaaaaaaaaaaaa","identity_scope":"primary_file_bytes","media_type":"model/ply","original_name":"artifact.ply","role":"primary_mesh","sha256":"aaaaaaaaaaaaaaaaaaaaaaaaaaaaaaaaaaaaaaaaaaaaaaaaaaaaaaaaaaaaaaaa","size_bytes":123}],"source_metadata_revisions":[{"axes":{"source_x":"+X","source_y":"+Y","source_z":"+Z"},"confirmation_status":"confirmed","created_at":"2026-07-11T00:00:00Z","extensions":{},"geometry_revision_id":"geometry:g1","handedness":"right","id":"metadata:m1","operator":"tester","parent_id":null,"source_to_canonical_mm":[[10.0,0.0,0.0,0.0],[0.0,10.0,0.0,0.0],[0.0,0.0,10.0,0.0],[0.0,0.0,0.0,1.0]],"unit":"cm"}]}
